topic,job_title,site (remote country),tasks,Perks/Benefits,Skills/Tech-stack required,Educational requirements,seniority,yoe,employment_type,extra_info,created_at,job_id,posted_by
Data Science,IN_Senior Associate_ Snowflake Senior Data Engineer_Data and Analytics_Advisory_Bangalore,"Bengaluru Millenia, India","Build and optimize data pipelines
Build batch and near real-time ETL pipelines
Create modular Python scripts for automation
Design and develop data solutions
Design data models and database structures
Optimize datasets for performance and cost efficiency
Write and tune complex SQL queries","Flexibility programs
Inclusive benefits
Mentorship
Work-life balance","Active Listening, Agile Scalability, Apache Airflow, AWS, Azure, Azure Data, Azure Data Factory, Data anonymization, Data Architecture, Database Design, Database optimization, Database security, Databricks, Data Engineering, Data Factory, Data Governance, Data Infrastructure, Data integration, Data Lake, Data Management, Data Modeling, Data pipeline, Data Security, Data Transformation, DBT, ETL Pipelines, Hadoop, NumPy, Pandas, Performance Tuning, PySpark, Python, Snowflake, SQL","Bachelor of Engineering, Master of Business Administration, Master of Engineering, MBA, MCA, M.Tech",Senior level / Expert,5,Full Time,,2025-08-08,ds-in-senior-associate-snowflake-senior-data-engineer-data-and-analytics-advisory-bangalore-01,taylor-anderson@demo
Machine Learning,"Data Scientist III, Research","Mountain View, CA, USA; New York, NY, USA","Collaborate with stakeholders to identify and clarify business questions
Design and evaluate mathematical models
Format, validate, and review data for analysis
Gather, extract, and compile data from multiple sources
Improve and evaluate product performance using analytics
Solve product and business problems","Benefits
Bonus
Equity","Business Intelligence, Data Analysis, Data Modeling, Data Storytelling, Data Visualization, Machine Learning, Python, R, SQL, Statistical Analysis","Bachelor's Degree, Master's Degree",Senior level / Expert,3,Full Time,USD 141K-202K,2025-08-09,ml-data-scientist-iii-research-01,reid-howell@demo
Machine Learning,Delivery Solutions Architect - Healthcare & Life Sciences,Remote - California [R],"Conduct discovery workshops
Coordinate with product and engineering teams
Create strategic roadmaps and business analysis
Develop and execute customer success plans
Drive customer onboarding and success
Lead post-sale technical account strategies
Manage stakeholder relationships
Manage technical issues and escalations
Report on customer health and KPIs
Support product adoption and growth strategies","Comprehensive benefits
Equity
Flexible work options
Performance bonus","AI and ML, AI and ML fundamentals, Business Analysis, Cloud Cost Optimization, Cost Optimization, Customer Success, Data Architecture, Data Engineering, Data Systems, Distributed data, Distributed data systems, ML Fundamentals, Project Management, Python, Scala, Solution architecture, SQL, Stakeholder management, Technical Project Management, Workshop facilitation","Bachelor's Degree in Computer Science, Engineering, Information Systems",Senior level / Expert,5,Full Time,USD 129K-180K,2025-08-08,ml-delivery-solutions-architect-healthcare-and-life-sciences-01,williams_and_sons@demo
Machine Learning,"People Services Analytics Specialist (remote, contract)","San Francisco, CA, United States [R]","Analyze and interpret People data
Collaborate with HR and business leaders
Create reports and dashboards
Maintain data accuracy and integrity
Provide HR insights",,"Analytical Thinking, Dashboard creation, Data Analysis, Data Systems, Data Visualization, HR Data, HR data systems, One Model, Power BI, Problem Solving, Report Development, Stakeholder Communication, Tableau, VISI","Bachelor's Degree, Bachelor’s diploma",Mid-level / Intermediate,3,Contract,,2025-08-08,ml-people-services-analytics-specialist-remote-contract-01,parker-kemp@demo
Machine Learning,"People Services Analytics Specialist (remote, contract)","Chicago, IL, United States [R]","Analyze and interpret People data
Collaborate with HR and business leaders
Compile and analyze customer, account, and transactional data
Create dashboards and reports
Design and develop data visualizations",,"Business Intelligence, Communication skills, Data Analysis, Databricks, Data cloud, Data Governance, Data Management, Data Mining, Data Visualization, MS Excel, MS PowerPoint, MS Word, Power BI, Presentation Skills, Problem Solving, Python, R, Salesforce data, Salesforce Data Cloud, SAS, SQL Assistant, Statistical software, Team leadership","Bachelor's Degree, Quantitative Discipline",Mid-level / Intermediate,3,Contract,,2025-08-08,ml-people-services-analytics-specialist-remote-contract-02,pham_ltd@demo
Machine Learning,Data Engineer 4,"Sacramento, CA, US","Assist in UI and application prototype design
Build scalable data pipelines
Design relational databases
Work with Power BI, SQL, KNIME, Power Platform tools, and Python for automation and process improvement","Hands-on project experience
Long-term internship
Practical placement","Automation, Data Analysis, Data Visualization, English communication, KNIME, Power Apps, Power Automate, Power BI, Problem Solving, Python, SQL, Troubleshooting","Bachelor's Degree, Economic Management Science, Engineering, Undergraduate",Senior level / Expert,8,Contract,,2025-08-08,ml-data-engineer-4-01,payne-johnston@demo
Machine Learning,Data Science Manager,"Prague, Praha, Hlavní město, Czechia","Build simple data pipelines
Clean and validate data
Collaborate with analysts
Create visualizations using Power BI
Develop dashboards and reports
Ensure reproducibility of work
Excel
Gather data from sources
Learn new tools and techniques
Maintain documentation
Organize raw data
Perform exploratory data analysis
Present insights to stakeholders
Stay updated with industry trends
Tableau
Translate business needs into analysis
Use statistical techniques and data mining",,"Business Analysis, Collaboration, Data Analysis, Data cleaning, Data Documentation, Data Mining, Data Pipelines, Data Visualization, Excel, Power BI, Statistical Analysis, Tableau","Bachelor's Degree, Master's Degree",Entry-level / Junior,1,Full Time,,2025-08-08,ml-data-science-manager-01,parks_and_sons@demo
Machine Learning,"Data Scientist, Business and Marketing, Ads Marketing Analytics (Spanish, English)","Mexico City, CDMX, Mexico","Build and prototype analysis pipelines
Conduct exploratory data analysis
Define questions on advertising effectiveness and privacy impact
Deliver insights to business partners and executives
Develop and implement quantitative analysis methods
Identify opportunities for advertising measurement improvements
Interact cross-functionally with leaders and teams
Solve non-routine analysis problems
Work with large, complex data sets",,"Causal Inference, Data Analysis, Data Modeling, Data Querying, Data Visualization, Econometric methods, Pipeline Development, Python, R, Sampling methods, SQL, Statistical Analysis, Statistical software","Master's Degree, PhD",Senior level / Expert,8,Full Time,,2025-08-08,ml-data-scientist-business-and-marketing-ads-marketing-analytics-spanish-english-01,williams_and_sons@demo
Machine Learning,Senior Data & Applied Scientist,"Noida, Uttar Pradesh, India","Collaborate with stakeholders on data needs and telemetry best practices
Experiment with machine learning models for sales and cost prediction
Monitor measure and explore large datasets
Support optimization projects in retail using analytics
Work closely with engineering team to enhance pipelines and model code","30 days vacation
Autonomy
Flexible working hours
Great team culture
Homeoffice 2-3 days","BigQuery, Data Analysis, Data pipeline, Data Pipeline Development, Google Cloud, Machine Learning, Model Optimization, Pipeline Development, Python, SQL, TensorFlow, Version control, Version Control (Git)","Bachelor, Master",Senior level / Expert,7,Full Time,,2025-08-08,ml-senior-data-and-applied-scientist-01,williams_armstrong_and_ware@demo
Machine Learning,Engineering Manager - Data + AI Observability,"Bengaluru, India","Build and scale data platforms
Build platform solutions for software teams
Conduct pattern analysis and predictive modelling
Coordinate with data teams for data management
Develop machine learning algorithms and statistical models
Identify training needs and conduct workshops
Implement tracking mechanisms for performance
Lead data collection, preparation, and validation",,"Data Analysis, Data Management, Data Validation, Machine Learning, Model Testing, Performance Tracking, Project Management, Python, Research Collaboration, Solution piloting, Stakeholder Communication, Statistical Modelling, Training Facilitation, Vendor management","B.E, B.Tech, MBA, M.Tech",Senior level / Expert,10,Full Time,,2025-08-08,ml-engineering-manager-data-ai-observability-01,roth-williams@demo
Machine Learning,Data Governance Program Lead,"Winnipeg, MB, Canada","Collaborate with cybersecurity, privacy, and legal teams
Apply SQL window functions for data transformation
Architect end-to-end Power BI solutions
Collaborate with business users to gather requirements
Coordinate with data engineers for data ingestion and transformation
Create complex DAX formulas and measures
Design and develop Power BI dashboards and reports
Design and implement advanced visualizations including Sankey and drill-down charts
Integrate machine learning outputs into Power BI reports
Lead data modeling efforts for performance and scalability
Optimize reports for performance and usability
Perform data validation and quality checks",,"APIs, Azure Data, Azure Data Services, Azure Synapse, BI Architecture, Communication, Continuous Improvement, Data Analysis, Data Modeling, Data Services, Data Transformation, Data Validation, Data Visualization, Data Warehousing, DAX, Deep learning, ETL Processes, Excel, Machine Learning, Machine Learning Integration, Performance optimization, Power BI, Power BI architecture, Power BI certification, Problem Solving, Python (NLP, Deep Learning), SharePoint, SQL, SQL Server, Teamwork","Bachelor, Master",Senior level / Expert,7,Full Time,,2025-08-08,ml-data-governance-program-lead-01,osborne_burgess_and_moon@demo
Machine Learning,Sr.AI Engineer,"Chennai, Tamil Nadu, India","Build AI solutions for event correlation and root cause analysis
Design and deploy AI products and platforms
Develop machine learning models for IT operations
Implement MLOps practices for scalable deployment
Integrate data science solutions with cloud and AIOps platforms
Lead cross-functional collaboration and mentorship
Maintain best engineering practices in code and documentation
Optimize system performance and reliability
Translate business problems into data science solutions",,"AIOps platforms, Ansible, APIs, AWS, Azure, CI/CD, Cloud Computing, Containerization, Cybersecurity, Data Engineering, Data Pipelines, Data Tagging, Deep learning, Docker, GCP, Kubernetes, Log Analytics, Machine Learning, MLOps, Network Automation, Python, Retrieval-Augmented Generation, Statistical modeling, Terraform","Master's Degree, Ph.D.",Senior level / Expert,8,Full Time,,2025-08-08,ml-sr-ai-engineer-01,chan_vazquez_and_carter@demo
Machine Learning,Data Science - Assistant Manager,"Bangalore, Karnataka, India","Communicate insights to stakeholders
Develop and implement machine learning and GenAI solutions
Evaluate and refine model performance
Maintain documentation for models and processes
Design, implement, and launch data science solutions
Develop key metrics and observability",,"Data Analysis, Data collection, Data refinement, Data Storytelling, Econometric Modeling, Experiment design, Machine Learning, Statistical Analysis","MS, PhD",Mid-level / Intermediate,8,Full Time,,2025-08-08,ml-data-science-assistant-manager-01,klein_adams_and_lee@demo
Machine Learning,IN_Senior manager_Data Architect_Data and Analytics_Advisory_Bangalore,"Remote-IL, United States [R]","Automate data tasks and improve efficiency
Build real-time data processing applications
Collaborate on data architecture and solutions
Design and maintain large-scale data structures
Develop data pipelines for reports and analytics
Engage with DevSecOps for CI/CD
Ensure data quality and reliability
Implement data ingestion, transformation, validation, and optimization","401k
Flexible work arrangements
Health insurance
Paid time off
Remote/hybrid options
Stock plans
Tuition reimbursement","Big Data, Big data processing, C#, Cloud infrastructure, Data Automation, Data Management, Data Mining, Data pipeline, Data pipeline optimization, Data Processing, Data Quality, Data quality assurance, Data Validation, Java, Pipeline Optimization, Python, Quality Assurance, Snowflake, SQL",Bachelor's Degree,Mid-level / Intermediate,3,Full Time,USD 62K-112K,2025-08-08,ml-in-senior-manager-data-architect-data-and-analytics-advisory-bangalore-01,mckenzie-callahan@demo
Machine Learning,IN_Senior Associate_ Snowflake Senior Data Engineer_Data and Analytics_Advisory_Bangalore,"Bengaluru Millenia, India","Build and optimize data infrastructure
Build batch and real-time ETL pipelines
Create and tune SQL queries and stored procedures
Design and develop data solutions
Design data solutions considering scalability, cost, disaster recovery, and high availability
Develop and deploy data integration and processing software
Ensure service reliability and define SLAs","Flexibility programs
Inclusive benefits
Mentorship
Wellbeing support
Work-life balance initiatives","Agile methodology, Azure, Azure Data, Azure Data Factory, Azure Data Lake, Azure DevOps, Azure SQL, Azure SQL Database, CI/CD, CI/CD pipelines, Cloud Data, Cloud Data Architecture, Containerization, Data Architecture, Databricks, Data Factory, Data Lake, Data Management, Data Modeling, Data Pipelines, Data Quality, Data Security, Data Visualization, Distributed Systems, Infrastructure as Code, PySpark, Python, Solution design, Spark, SQL, SQL Database, Synapse, Workload optimization","Bachelor, Master",Senior level / Expert,5,Full Time,,2025-08-08,ml-in-senior-associate-snowflake-senior-data-engineer-data-and-analytics-advisory-bangalore-01,friedman_llc@demo
Machine Learning,IN_Senior manager_Data Architect_Data and Analytics_Advisory_Bangalore,"Bengaluru Millenia, India","Build and maintain infrastructure as code
Collaborate with cross-disciplinary teams in Agile environment
Design and maintain scalable data infrastructure
Design data solutions considering scalability, cost, disaster recovery, high availability
Develop and deploy data integration and processing software
Develop data engineering best practices
Ensure data quality and reliability
Implement CI/CD pipelines
Manage data repositories with Git
Monitor and troubleshoot data pipelines",,"Airflow, Automation, CI/CD, Cloud Storage, Collaboration, Communication, Data Modeling, DataOps, Data Pipelines, Data Transformation, Data Warehousing, DBT, GCP BigQuery, Git, Problem Solving, Python, SQL, Terraform, Troubleshooting","Bachelor's, Bachelor's Degree, Undergraduate",Senior level / Expert,10,Full Time,,2025-08-08,ml-in-senior-manager-data-architect-data-and-analytics-advisory-bangalore-02,dixon_inc@demo
Machine Learning,Data & Analytics Analyst AVP,"Chennai, India","Capture, validate, and document data and business requirements
Conduct options analysis and identify solutions
Create and execute quality assurance for data and analysis validation
Ensure traceability of analytics outputs to business requirements
Improve business processes for better customer outcomes
Interrogate, interpret, and visualize large data sets
Manage data analysis to identify business issues and opportunities
Perform data extraction, storage, manipulation, and analysis
Support development and implementation of business solutions",,"Business Analysis, Communication skills, Data Analysis, Data extraction, Data Management, Data Processing, Data Quality, Data quality assurance, Data Visualization, Excel, Power BI, Problem Solving, Quality Assurance, SQL, Tableau","Bachelor's Degree, Master's Degree",Executive level / Director,5,Full Time,,2025-08-08,ml-data-and-analytics-analyst-avp-01,stewart_gates_and_kelley@demo
Machine Learning,Big Data Engineer II (56096),"AUS - Melbourne, Australia","Build and mentor data science teams
Communicate data science value to stakeholders
Deliver end-to-end data solutions
Drive regional AI adoption
Ensure technical best practices
Foster collaboration across functions
Utilize advanced analytics techniques to derive insights
Work with cloud platforms like AWS","Flexibility programs
Inclusive benefits
Mentorship
Work-life balance support","Airflow, AWS, Business Intelligence, Data Analysis, Data Architecture, Database Management, Databricks, Data Cleansing, Data Ingestion, Data Management, Data pipeline, Data Science, Data Storage, Data storage formats, Data Transformation, Data Visualization, Kafka, Python, Snowflake, Spark, SQL, Storage Formats","Bachelor Degree, Master Degree, MBA, MCA, M.Tech",Senior level / Expert,10,Full Time,,2025-08-08,ml-big-data-engineer-ii-56096-01,reid-howell@demo
Machine Learning,Associate Director Data Science,"London (The Westworks), United Kingdom","Collaborate with internal and external partners
Design data solutions
Develop and maintain data pipelines
Develop data models and documentation
Ensure data security and privacy
Explore new data tools and technologies
Follow best coding and testing practices
Implement ETL/ELT processes
Leverage cloud platforms for data solutions
Participate in sprint planning
Troubleshoot data challenges",,"Apache Spark, Automated testing, AWS, Big Data, Big Data Technologies, CI/CD, Cloud Data, Cloud Data Platforms, Data Analysis, Databricks, Data integration, Data Modeling, Data platforms, Data Technologies, Data Visualization, Data Warehousing, ETL Tools, PySpark, Python, Redshift, SageMaker, Snowflake, SparkSQL, SQL, Version control","Bachelor's Degree, Diploma",Mid-level / Intermediate,5,Full Time,,2025-08-08,ml-associate-director-data-science-01,klein_adams_and_lee@demo
Machine Learning,IN_Senior manager_Data Architect_Data and Analytics_Advisory_Bangalore,"Bengaluru Millenia, India","Adhere to software engineering standards including CI/CD pipelines
Build and maintain infrastructure as code and containerized deployments
Collaborate with cross-disciplinary teams in Agile environment
Design and maintain scalable data infrastructure
Design data solutions considering scalability, cost, disaster recovery, and high availability
Develop and deploy data integration and processing software
Ensure service reliability and define SLAs
Implement large-scale data ingestion and transformation projects on Azure
Mentor team members and conduct design reviews
Work with clients to deploy and audit cloud data solutions","Flexibility programs
Inclusive benefits
Mentorship
Wellbeing support","Agile methodologies, Azure, Azure Data, Azure Data Factory, Azure Data Lake, Azure DevOps, Azure SQL, Azure SQL Database, Big Data, Big Data Technologies, CI/CD, Cloud infrastructure, Containerization, Databricks, Data Factory, Data Governance, Data Lake, Data Modeling, Data Pipelines, Data Processing, Data Security, Data Technologies, Data Transformation, Distributed Systems, Infrastructure as Code, Monitoring and Alerting, PySpark, Python, Source Control, Spark, SQL, SQL Database, Synapse","Bachelor, Master",Senior level / Expert,8,Full Time,,2025-08-08,ml-in-senior-manager-data-architect-data-and-analytics-advisory-bangalore-03,taylor-anderson@demo
Machine Learning,"Snr Data Scientist, Data & AI Engr 1","Singapore, Singapore","Analyze data using engineering tools
Collaborate on data projects
Develop and maintain data pipelines
Ensure data quality and security
Process and transform data
Stay updated on industry trends
Support data collection and integration",,"Collaboration skills, Data Analysis, Data Engineering, Data Engineering Tools, Data pipeline, Data Pipeline Development, Data Processing, Data Security, Data Transformation, Engineering Tools, Industry trend awareness, Pipeline Development, Trend awareness","Advanced degree, Bachelor's Degree",Senior level / Expert,4,Full Time,,2025-08-08,ml-snr-data-scientist-data-and-ai-engr-1-01,taylor-anderson@demo
Machine Learning,IN_Senior manager_Data Architect_Data and Analytics_Advisory_Bangalore,"Bengaluru Millenia, India","Build and maintain infrastructure as code
Collaborate with cross-disciplinary teams in Agile environment
Design and maintain scalable data infrastructure
Design data solutions considering scalability, cost, disaster recovery, and high availability
Develop and deploy data integration and processing software
Develop and maintain CI/CD pipelines
Ensure service reliability and define SLAs
Implement large-scale data ingestion and transformation projects on Azure
Manage cloud deployment, security, and compliance
Mentor team members and conduct design reviews","Flexible work arrangements
Inclusive benefits
Mentorship opportunities
Wellbeing support","Azure, Azure Data, Azure Data Factory, Azure Data Lake, Azure DevOps, Azure SQL, Azure SQL Database, CI/CD, CI/CD pipelines, Cloud Architecture, Containerization, Databricks, Data Factory, Data integration, Data Lake, Data Modeling, Data Pipelines, Data Processing, Data Quality, Data Security, Data Transformation, Data Visualization, Distributed Systems, Infrastructure as Code, PowerBI, PySpark, Python, SAP data, SAP Data Integration, Spark, SQL, SQL Database, Synapse","Bachelor, Master",Senior level / Expert,10,Full Time,,2025-08-08,ml-in-senior-manager-data-architect-data-and-analytics-advisory-bangalore-04,taylor-anderson@demo
Machine Learning,IN-Senior Associate Power BI_Data and Analytics_Advisory_Gurgaon,"Gurugram 8 B, India","Collaborate with cross-functional teams
Build and maintain infrastructure as code and containerized deployments
Collaborate with cross-disciplinary teams in Agile environment
Design and maintain scalable data infrastructure
Design data solutions considering scalability, cost, disaster recovery, and high availability
Develop and deploy data integration and processing software
Ensure service reliability and define SLAs
Implement large-scale data ingestion and transformation projects on Azure
Mentor team members and conduct design reviews","Flexible work arrangements
Impactful client projects
Inclusive benefits
Mentorship opportunities
Work in innovative environment","Agile methodology, Azure Data, Azure Data Factory, Azure Data Lake, Azure DevOps, Azure SQL, Azure SQL Database, CI/CD, CI/CD pipelines, Cloud Computing, Containerization, Databricks, Data Factory, Data Lake, Data Modeling, Data pipeline, Data Pipeline Development, Data Security, Data Security and Privacy, Data Transformation, Data Warehousing, Distributed Systems, Distributed Systems Design, Infrastructure as Code, Pipeline Development, PySpark, Python, Security and Privacy, Spark, SQL, SQL Database, Synapse Analytics, Systems Design","Bachelor, Master, MBA, MCA, M.Tech",Mid-level / Intermediate,4,Full Time,,2025-08-08,ml-in-senior-associate-power-bi-data-and-analytics-advisory-gurgaon-01,payne-johnston@demo
Machine Learning,IN_Senior manager_Data Architect_Data and Analytics_Advisory_Bangalore,"Bengaluru Millenia, India","Build and maintain infrastructure as code
Collaborate with departments
Collect data
Design reports
Develop dashboards
Monitor KPIs
Process data
Propose improvements
Support digital projects","Career development
Health insurance
Learning opportunities
Supportive environment","Analytics Cloud, Business Intelligence, Data Analysis, Data Visualization, DAX, Excel, Power BI, Reporting, SAP Analytics, SAP Analytics Cloud, SQL, Statistical concepts, Web Intelligence","Bachelor's Degree, Bachelor’s diploma",Senior level / Expert,10,Full Time,,2025-08-08,ml-in-senior-manager-data-architect-data-and-analytics-advisory-bangalore-05,bender_plc@demo
Machine Learning,IN_Senior manager_Data Architect_Data and Analytics_Advisory_Bangalore,"Bengaluru Millenia, India","Build and maintain infrastructure as code
Collaborate with cross-disciplinary teams in Agile environment
Collaborate with data scientists on machine learning models
Communicate complex data insights
Design and implement data warehouses and data lakes
Develop processing and analysis algorithms
Identify and mitigate data risks
Lead or guide team members on data projects
Perform complex data analysis
Support operational effectiveness and policy development",,"Complex data analysis, Data Analysis, Data Architecture, Data Collaboration, Data Communication, Data Lakes, Data Pipelines, Data Processing, Data Security, Data Warehouses, Machine Learning, Risk Management, Team leadership","Bachelor's Degree, Master's Degree",Senior level / Expert,8,Full Time,,2025-08-08,ml-in-senior-manager-data-architect-data-and-analytics-advisory-bangalore-06,richardson_kennedy_and_johnson@demo
