topic,job_title,site (remote country),tasks,Perks/Benefits,Skills/Tech-stack required,Educational requirements,seniority,yoe,employment_type,extra_info,created_at,job_id,posted_by
Artificial Intelligence,Senior Software Engineer,"Redmond, Washington, United States","Collaborate with stakeholders to determine user requirements
Create and conduct experiments to test product changes
Develop technical vision and roadmap
Drive ML infrastructure optimization
Lead large-scale ML projects
Manage cross-functional teams and projects
Oversee system design and review code
Set team priorities","Benefits
Bonus
Equity","AI/ML, Audio Processing, C#, C++, Data Compression, Data Processing, Debugging, Distributed Computing, Fine Tuning, Java, JavaScript, Language Processing, Large-Scale System Design, ML Infrastructure, Model Deployment, Model Evaluation, Natural Language, Natural Language Processing, Networking, Project Management, Python, Reinforcement Learning, Security, Speech/audio processing, System design, Team leadership, Technical Project Management","Bachelor's Degree, Master's Degree, PhD",Senior level / Expert,4,Full Time,USD 119K-258K,2025-08-08,ai-senior-software-engineer-01,stewart_freeman_and_fox@demo
Artificial Intelligence,"Software Engineer, AI Foundations","New Taipei, Banqiao District, New Taipei City, Taiwan","Collaborate across teams to influence roadmaps
Design tools and frameworks for AI development
Develop evaluation datasets and metrics
Evaluate and improve AI model performance
Implement NLP and computer vision algorithms
Mentor junior team members","Paid time off
Performance bonus
Training & development
Work from home","Big Data, Big data processing, C++, Communication, Computer Vision, Data Analysis, Data Processing, Hadoop, Java, Language Processing, Natural Language, Natural Language Processing, Problem Solving, Python, PyTorch, Spark, TensorFlow","Bachelor's Degree, Master's Degree",Mid-level / Intermediate,2,Full Time,,2025-08-08,ai-software-engineer-ai-foundations-01,burns-parsons@demo
Artificial Intelligence,AI Agent Developer,"Manila, Metro Manila, Philippines","Collaborate with cross-functional teams
Design AI-driven agents
Conduct AI enablement sessions and workshops
Create and optimize indexing strategies for performance
Deploy AI applications using Azure AI Services
Develop custom pipelines for document ingestion and embedding
Implement and evaluate embedding models and chunking strategies
Participate in code reviews and ensure system reliability",,"Azure AI, Azure Cognitive, Azure Cognitive Search, Cloud deployment, Cognitive Search, Copilot extensions, Custom Copilot extensions, Faiss, Generative AI, GitHub, Langchain, Llamaindex, LLMs, Pinecone, Prompt engineering, Prompt Tuning, Python, Retrieval-Augmented Generation, Vector Databases, Version control","Bachelor's Degree, Master's Degree",Senior level / Expert,2,Full Time,,2025-08-08,ai-ai-agent-developer-01,klein_adams_and_lee@demo
Artificial Intelligence,Forward Deployed AI Engineer - Enterprise,"London, UK, San Francisco & Palo Alto, CA","Add logging and metrics
Analyze logs and prompt data
Benchmark and evaluate models
Design generative AI solutions leveraging AWS services
Develop white papers, blogs, reference implementations, presentations
Drive AI adoption in government agencies
Enable large-scale customer use cases
Guide customer engagements
Help customers architect enterprise AI solutions","Career growth resources
Diverse experiences encouraged
Inclusive team culture
Mentorship opportunities
Work-life balance","AI ecosystem, AI ecosystem knowledge, Artificial Intelligence, AWS Cloud, AWS Cloud Services, Cloud services, Cost Optimization, Customer Engagement, Data Science, Deep learning, Ecosystem knowledge, Generative AI, Machine Learning, Model Deployment, Python, Reference Development, Software Architecture, Solution design, Technical Communication","Bachelor's Degree, Master's Degree",Senior level / Expert,6,Full Time,USD 180K-440K,2025-08-08,ai-forward-deployed-ai-engineer-enterprise-01,chan_vazquez_and_carter@demo
Artificial Intelligence,Project Lead-App Development,"INDIA - NOIDA- BIRLASOFT OFFICE, IN","Collaborate with teams to translate business needs into AI use cases
Design and implement Agentic AI solutions for IT operations
Oversee automation project development and deployment
Drive AI adoption in organization
Ensure AI compliance with regulations","Development programs
Educational support
Flexible work options
Inclusive environment","AI Governance, AWS, Azure, Databricks, Embeddings, Explainable AI, GCP, Generative AI, Graph AI, Hadoop, Knowledge graphs, Langchain, LLMs, MLOps, Neo4j, NLP, OpenAI, Python, PyTorch, RAG, Regulatory Standards, Retrieval systems, Spark, TensorFlow, Time Series, Time Series Analysis, Vector Databases","Bachelor, Master",Senior level / Expert,3,Full Time,,2025-08-08,ai-project-lead-app-development-01,chan_vazquez_and_carter@demo
Artificial Intelligence,Project Lead-App Development,"INDIA - NOIDA- BIRLASOFT OFFICE, IN","Collaborate with teams to translate requirements into AI use cases
Design and implement Agentic AI solutions for IT operations
Oversee automation project development and deployment
Review and improve existing automation solutions
Stay updated on AI and automation trends",,"Agentic AI, Aisera, Amelia, Ansible, C++, Chef, CI/CD, Docker, GenAI, Go, Java, Keras, Kubernetes, Langchain, Langgraph, Langsmith, Microsoft Copilot, Moveworks, NexThink, NLP, Powershell, Puppet, Python, PyTorch, Resolve, ServiceNow, Shell Scripting, TensorFlow, UiPath","Bachelor's Degree, Master's Degree",Senior level / Expert,3,Full Time,,2025-08-08,ai-project-lead-app-development-02,williams_and_sons@demo
Artificial Intelligence,"Data Scientist, Responsible AI Team (AI Practice)","SGP Pioneer Yard, Singapore","Create documentation
Design NLP systems
Develop and implement AI models
Optimize AI models
Research AI technologies
Test and validate models",,"API Integration, AWS, Azure, Cloud deployment, CSS, Deep learning, HTML, JavaScript, Keras, Language Processing, Machine Learning, Natural Language, Natural Language Processing, Node.js, NoSQL, PyTorch, React.js, Scikit-learn, SQL, TensorFlow","Bachelor's Degree, Master's Degree",Mid-level / Intermediate,3,Full Time,,2025-08-08,ai-data-scientist-responsible-ai-team-ai-practice-01,james-lowery@demo
Artificial Intelligence,[凱基金控] Ai 開發工程師,"國長大樓/ Guochang Building, Taiwan","Collaborate with cross-functional teams
Design and develop AI system architecture
Guide and coordinate AI and data development teams
Optimize system performance and troubleshoot issues
Research and evaluate AI technologies and tools",,"AI Model Training, AI system architecture, Big Data, Big Data Tools, Cloud Native, Cloud Native Architecture, Data Tools, Deep learning, Distributed Systems, Java, Language Processing, Machine Learning, Microservices, Model Deployment, Model Training, Natural Language, Natural Language Processing, Performance optimization, Python, PyTorch, Standards development, System Architecture, System security, Technical standards, Technical standards development, TensorFlow","Bachelor, Information Engineering, Information Management",Senior level / Expert,2,Full Time,,2025-08-08,ai-ai-01,mitchell-hoffman@demo
Artificial Intelligence,Responsible AI Senior Systems Engineer,"Herndon, VA, US | Washington, DC, US | Silver Spring, MD, US","Advise on AI technology transition strategies
Collaborate with stakeholders on AI system optimization
Collaborate with data scientists and engineers on proof-of-concept projects
Communicate effectively with technical and non-technical stakeholders
Integrate third-party GenAI services","Collaborative environment
Competitive benefits
Holidays
Paid time off
Rewards and recognition programs
Work-life balance","Agile methodologies, API Integration, Code Documentation, Data cleaning, GenAI Services, Node.js, Prompt engineering, Prototyping, Python, SQL","Bachelor's Degree, Technical Diploma",Senior level / Expert,5,Full Time,USD 115K-165K,2025-08-07,ai-responsible-ai-senior-systems-engineer-01,olson_aguilar_and_thomas@demo
Artificial Intelligence,Artificial Intelligence Engineer,"Redstone Arsenal, AL, US","Build and optimize machine learning pipelines with tools like Vertex AI
Collaborate with stakeholders to scope use cases
Design and deploy models including LLMs and Generative AI
Design and implement autonomous AI agents with custom prompting and workflows
Implement feature engineering for structured and unstructured data
Optimize models for performance and scalability
Use libraries like TensorFlow and PyTorch for experimentation and production","Competitive benefits
Empowerment
Fun work environment
Growth opportunities
Innovative projects
Small team environment
Work-life balance","Agent Development, Agentic Frameworks, AI Agent, AI Agent Development, AI/ML, AI/ML frameworks, AWS GCP, Cloud deployment, Cloud Platforms, Cloud Platforms (AWS, Cloud platforms AWS GCP, Feature Engineering, Gen AI, Generative AI, Graph AI, Langchain, Llamaindex, LLMs, ML frameworks, MLOps, Model Optimization, Python, PyTorch, RAG, TensorFlow, Vector Databases, Vertex AI","Bachelor's Degree, Master's Degree",Mid-level / Intermediate,3,Full Time,,2025-08-07,ai-artificial-intelligence-engineer-01,stewart_freeman_and_fox@demo
Artificial Intelligence,AI Team Lead,"Chennai, India","Design and develop generative AI models
Implement and optimize frontend and backend AI functionalities
Lead full AI project lifecycle from requirements to deployment
Mentor junior developers in AI and full stack development
Stay updated with AI advancements and integrate new tools and methods","401k match
Disability Life AD&D insurance
Education reimbursements
Flexible work
In-house training
Medical/Dental/Vision insurance","AI ethics, API Development, Automation frameworks, AWS, Azure, Chatbot Development, Cloud Platforms, Communication, Computer Vision, Data Governance, Deep learning, DevOps, Full Stack, Full stack technologies, GCP, Hugging Face, Langchain, Langgraph, Langsmith, Machine Learning, .NET, NLP, OpenAI, Problem Solving, Python, PyTorch, Security, Semantic Kernel, TensorFlow","AI, Bachelor's, Data Science, Master's in Computer Science",Senior level / Expert,9,Full Time,,2025-08-07,ai-ai-team-lead-01,smith_ltd@demo
Artificial Intelligence,Gen AI Developer,Pakistan,"Analyze and preprocess datasets
Apply Retrieval-Augmented Generation techniques
Design and implement end-to-end AI solutions
Develop Multi Model and RAG applications
Evaluate agent performance and communication standards
Explore and prototype LLM applications
Fine-tune LLMs and SLMs
Present technical concepts to stakeholders
Translate requirements into AI solutions",,"A2A, Agent communication, Agent communication standards, AI/ML, Autogen, AWS, Azure, Claude, Communication standards, Crew.ai, Databricks, Embeddings, GCP, Gemini, Langchain, Langgraph, Llama, Llamaindex, MCP, Mistral, MLOps, Model Orchestration, OpenAI, Prompt engineering, Python, Synthetic data","Bachelor's Degree, Master's Degree",Mid-level / Intermediate,5,Full Time,,2025-08-07,ai-gen-ai-developer-01,harrison_herrera_and_roberts@demo
Artificial Intelligence,AI Engineer (GenAI),"Quận 3, Vietnam","Build multi-agent orchestration systems
Collaborate with backend and prompt teams
Design RAG pipelines
Develop custom AI frameworks
Optimize application performance",,"Agile methodologies, AI Search, Azure OpenAI, CSS, Django, Docker, Flask, Git, HTML, JavaScript, Python, RAG Implementation, React, SQL","Bachelor's Degree, Master's Degree",Senior level / Expert,5,Full Time,,2025-08-07,ai-ai-engineer-genai-01,noble_wilson_and_decker@demo
Artificial Intelligence,Senior AI Developer,"Chennai, India","Collaborate with stakeholders to integrate AI into workflows
Conduct security assessments of AI solutions
Implement MLOps practices for deployment and monitoring",,"AWS, Azure, Data Preprocessing, Docker, GCP, Generative AI, Hugging Face, Hugging Face Transformers, Keras, Kubernetes, LLMs, MLOps, Model Deployment, Model Optimization, Prompt engineering, Python, PyTorch, SQL, TensorFlow","Bachelor, Master",Senior level / Expert,3,Full Time,,2025-08-07,ai-senior-ai-developer-01,burns-parsons@demo
Artificial Intelligence,Sr. AI Engineer,Madrid,"Communicate with stakeholders to align technology with business goals
Create reference architecture and visual diagrams
Design and implement intelligent automation solutions
Design application performance metrics
Ensure compliance with IT policies and standards
Identify development and support needs","401k matching
Dental insurance
Employee volunteer program
Medical insurance
Time off
Tuition assistance
Wellness program","Agentic AI, Automation Anywhere, Automation platforms, Azure DevOps, Banking, Blue Prism, Compliance Standards, Financial Services, Generative AI, Governance, ICR, IT Development, IT Networking, IT Support, LLMs, Low Code, Low Code Automation, Low-code automation platforms, Microsoft Power Platform, Nintex K2, OCR, Power Platform, Process Automation, Project Management, Risk Mitigation, Robotic Process Automation, RPA, Team leadership, UiPath",Bachelor's Degree,Senior level / Expert,4,Full Time,,2025-08-07,ai-sr-ai-engineer-01,figueroa_and_sons@demo
Artificial Intelligence,AI Engineer,"(HE)Office Bangalore, Brigade Opus, India","Build and deploy AI prototypes using MaaS platforms
Design and develop full-stack applications
Implement MVC architecture
Integrate AI/ML models into products
Participate in code reviews
Stay updated with industry trends
Troubleshoot and optimize performance
Write clean, maintainable code",,"Agile methodologies, AI/ML, AI/ML Integration, API Design, APIs, AWS, Azure, Babel, Cloud services, Express, GCP, Git, JavaScript, ML integration, MVC Architecture, Node.js, NoSQL, Python, PyTorch, React, RESTful API, RESTful API design, SQL, TensorFlow, TypeScript, Webpack","Bachelor's Degree, Master's Degree",Senior level / Expert,6,Full Time,,2025-08-07,ai-ai-engineer-01,stewart_gates_and_kelley@demo
Artificial Intelligence,AI Engineer,"Plano, TX, US","Apply containerization and deployment techniques
Collaborate with cross-functional teams
Communicate technical concepts
Design and implement AI/ML solutions
Develop prototypes and POCs
Develop RAG applications and agentic workflows
Fine-tune and deploy OpenAI models
Integrate LLMs into enterprise applications
Stay updated on AI advancements",,"AI integration, AI/ML, AI/ML Development, Angular, Azure OpenAI, Chainlit, Cloud services, Containerization, Content Analytics, Deep learning, Deployment, Fine Tuning, Flask, Generative AI, Langchain, Llama Index, LLMs, Machine Learning, ML development, Model Fine-tuning, NLP, OpenAI models, Pinecone, Prompt engineering, Python, React, SQL, Streamlit, TensorFlow, Vector Databases",Bachelor's Degree,Mid-level / Intermediate,3,Full Time,,2025-08-07,ai-ai-engineer-02,smith_ltd@demo
Artificial Intelligence,"Senior Lead Software Engineer, AI Engineering",Remote - Ukraine [R],"Build scalable AI infrastructure
Collaborate across teams to improve developer experience
Design AI-powered developer tools
Embed Gen-AI into CI/CD and development processes
Evaluate new AI/ML technologies
Integrate intelligent agents into workflows
Mentor engineering team","Collaborative environment
Innovation-driven culture
Mentorship opportunities","Agent Frameworks, AI/ML, AI/ML Development, AI/ML libraries, AI Tooling, C#, Go, JavaScript, LLM integration, ML development, ML Libraries, Open Source, Open-source contributions, Python, System design, TypeScript, Vector Databases","Bachelor's Degree, Master's Degree",Senior level / Expert,5,Full Time,,2025-08-07,ai-senior-lead-software-engineer-ai-engineering-01,mckenzie-callahan@demo
Artificial Intelligence,AI Architect,"7 Merchant Place, 9 Fredman Drive, Sandton, Johannesburg, 2196, South Africa","Align AI initiatives with business objectives
Build collaborative relationships across teams
Collaborate with cross-functional teams on AI requirements
Create AI strategies and roadmaps
Design AI system architecture
Develop data pipelines and deployment strategies
Optimize and fine-tune AI models
Stay updated with AI/ML advancements","Comprehensive benefits
Development programs
Educational support
Flexible work options
Inclusive environment","AI Governance, AWS, Azure, Databricks, Embeddings, GCP, Generative AI, Graph AI, Hadoop, Knowledge graphs, Langchain, LLMs, MLOps, Neo4j, OpenAI, Python, PyTorch, RAG, Retrieval systems, Spark, TensorFlow, Vector Databases","Bachelor, Master",Senior level / Expert,5,Full Time,,2025-08-07,ai-ai-architect-01,patterson_inc@demo
Artificial Intelligence,AI Enablement engineer - Assistant Vice President,"Bangalore, India","Collaborate with cross-functional teams
Communicate technical concepts to stakeholders
Design, develop, and deploy AI/ML models
Drive AI adoption in organization
Ensure AI compliance with regulations
Integrate AI into business processes
Optimize and fine-tune AI models
Stay updated with AI/ML advancements","Comprehensive benefits
Development programs
Educational support
Flexible work options","AI Governance, AWS, Azure, Databricks, Data Engineering, Embeddings, GCP, Generative AI, Graph AI, Hadoop, Knowledge graphs, Langchain, LLMs, MLOps, Neo4j, OpenAI, Python, PyTorch, RAG, Retrieval systems, Spark, TensorFlow, Vector Databases","Bachelor, Master",Executive level / Director,3,Full Time,,2025-08-07,ai-ai-enablement-engineer-assistant-vice-president-01,martin-bennett@demo
Artificial Intelligence,AI & Analytics Engineer,"Bengaluru, Karnataka, India","Build and maintain data pipelines
Collaborate with cross-functional teams
Conduct exploratory data analysis
Develop dashboards and analytics tools
Evaluate models and track metrics
Integrate AI solutions into data workflows
Stay updated on AI trends
Support prompt design and testing",,"APIs, Data Visualization, Git, JSON, Langchain, Machine Learning, OpenAI APIs, Pandas, Power BI, Python, REST APIs, Scikit-learn, SQL, Streamlit, Version control","Bachelor's Degree, Master's Degree",Entry-level / Junior,1,Full Time,,2025-08-07,ai-ai-and-analytics-engineer-01,dixon_inc@demo
Artificial Intelligence,AI Fullstack Developer,United States - Remote [R],"Build scalable RESTful APIs
Design and develop full-stack applications
Create prototypes and pilot projects demonstrating GenAI impact
Define architectural strategy focusing on scalability, security, and compliance
Design and deliver GenAI solutions for enterprise clients
Engage with clients to translate needs into architectures
Ensure solutions meet standards like SOC 2, HIPAA, FedRAMP, GDPR
Lead project development from concept to deployment",,"AI architecture, AI Risk, AI risk management, Client engagement, Data Governance, Enterprise Integration, Fine Tuning, GenAI tools, Leadership, Model Fine-tuning, Prompt engineering, RAG, Risk Management, Solution design, Vector Databases","AI, Computer Science, Engineering",Senior level / Expert,5,Contract,USD 150K-170K,2025-08-07,ai-ai-fullstack-developer-01,green_schmidt_and_yoder@demo
Artificial Intelligence,"AI Application Engineer, Marketing Technology and Engineering","Mexico City, CDMX, Mexico","Build and deploy GenAI solutions
Collaborate with AI Engineers for integration
Collect, clean, and preprocess data
Conduct exploratory data analysis
Contribute to best practices and playbooks
Develop and refine ML models
Document development processes
Evaluate and optimize model performance
Monitor AI outputs for bias and accuracy
Stay updated with AI/ML trends",,"AI, Bias Mitigation, Chatbots, Data Pipelines, Data Preprocessing, Fine Tuning, Language Models, Large Language Models, LLMs, ML, Model Deployment, Model Evaluation, Model Fine-tuning, Python, PyTorch, Retrieval-Augmented Generation, TensorFlow, Version control","Bachelor's Degree, Master's Degree",Mid-level / Intermediate,4,Full Time,,2025-08-06,ai-ai-application-engineer-marketing-technology-and-engineering-01,erickson_bean_and_robinson@demo
Artificial Intelligence,Director of AI & ML,"Denver, CO, United States","Collaborate with stakeholders
Design and implement AI solutions
Develop AI automation strategy
Drive change management
Educate organization on AI benefits
Evaluate new AI tools and technologies
Identify automation opportunities
Manage AI projects and vendors
Monitor and optimize automation performance",,"AI, AI frameworks, AI Services, Change Management, Cloud AI, Cloud AI services, Data Analysis, Language Processing, Machine Learning, Natural Language, Natural Language Processing, Process Automation, Project Management, Robotic Process Automation, Solution design, Vendor management","Bachelor's Degree, Master's Degree",Executive level / Director,5,Full Time,,2025-08-06,ai-director-of-ai-and-ml-01,roth-williams@demo
Artificial Intelligence,Lead AI Engineer,"Pune, Maharashtra, India","Apply machine learning, NLP, GenAI, optimization techniques
Build and deploy end-to-end models
Collaborate with business units to translate data into insights
Develop AI solutions for business problems
Implement AI models in production environments
Mentor junior team members
Partner with academia and internal teams
Research and improve AI/ML techniques
Work with structured and unstructured datasets","Career development opportunities
Flexible-hybrid work
Inclusive environment
Paid Purpose Day
Recognition programs
Wellbeing support","AI Lifecycle, AI Lifecycle Management, APIs, Autogen, Azure, Big Data, Big Data Technologies, Critical Thinking, Data Analysis, Databricks, Data Engineering, Data Technologies, Data Visualization, Docker, GANs, Generative Models, Git, Hypothesis Testing, Kubernetes, Langchain, Lifecycle Management, Model Deployment, Model Evaluation, NLP, NLU, Object-Oriented, Object-oriented programming, Probability, Python, PyTorch, Regression Analysis, Reinforcement Learning, Scikit-learn, Semantic Kernel, Spark, SQL, Statistical Analysis, TensorFlow, Transformers, VAEs","Bachelor's Degree, Master's Degree, PhD",Senior level / Expert,7,Full Time,,2025-08-06,ai-lead-ai-engineer-01,stewart_gates_and_kelley@demo
Artificial Intelligence,Senior AI Engineer,"Ho Chi Minh, Vietnam","Collaborate with cross-functional teams
Build prototypes for AI features
Develop and maintain backend APIs
Support AI integrations and system improvements","Collaborative team environment
Growth in AI and backend skills
Mentorship
Opportunity to work on AI projects","AI API, AI API integration, API Development, API Integration, Application Frameworks, Cloud services, Debugging, DevOps practices, FastAPI, Langchain, OpenAI APIs, Python, RESTful APIs, SQL","Associate Degree, Bachelor's Degree, High School Diploma",Senior level / Expert,3,Full Time,,2025-08-06,ai-senior-ai-engineer-01,reeves_lee_and_cooper@demo
Artificial Intelligence,Staff AI Engineer,Spain,"Collaborate with cross-functional teams including clients and stakeholders
Design and deliver conversational agents handling high-volume interactions
Implement AI strategies
Integrate AI solutions
Optional frontend development
Use Java for development
Utilize AWS services",,"AI integration, API Development, AWS, Backend architecture, Chatbot, Frontend Development, Java, LLM, Python","Bachelor's Degree, Master's Degree",Senior level / Expert,5,Full Time,,2025-08-05,ai-staff-ai-engineer-01,taylor-anderson@demo
Artificial Intelligence,AI/ML Engineer,"Haryana, Gurugram, India","Collaborate with cross-functional teams to integrate AI solutions
Conduct data analysis and preprocessing
Design algorithms and experiment with AI techniques
Develop reusable templates and accelerators
Grow and manage AI solutions team and P&L
Lead customer engagement to understand business needs
Manage partnerships and resourcing
Oversee AI solution delivery from pilot to deployment","Benefits
Stock options","Artificial Intelligence, Business Strategy, Cross-Functional Collaboration, Customer Engagement, Machine Learning, Project Management, Solution architecture, Solution Delivery, Stakeholder management, Team leadership","Bachelor's Degree, Master's Degree, PhD",Mid-level / Intermediate,3,Full Time,,2025-08-05,ai-ai-ml-engineer-01,patterson_inc@demo
Artificial Intelligence,AI Developer,"Sunnyvale, CA, USA","Build user-facing components for AI agent management
Collaborate with research teams to shape AI frameworks
Develop multi-agent orchestration and real-time data analysis core
Explore and implement new AI/ML technologies to improve system performance
Implement transparency, monitoring, and explainability features for AI agents","Benefits
Bonus
Equity","Agent Orchestration, AI Agent, AI agent orchestration, AI/ML, AI/ML technologies, Collaboration with research teams, Data Analysis, Distributed Systems, Explainability in AI, Full Stack, Full-Stack Development, ML Infrastructure, ML Technologies, Monitoring and Logging, Real Time, Real-time Data, Real-time Data Analysis, Software Design, System Architecture","Bachelor's Degree, Master's Degree, PhD",Senior level / Expert,8,Full Time,USD 197K-291K,2025-08-05,ai-ai-developer-01,webster_rhodes_and_bishop@demo
